{
  "categories": [
    {
      "id": "office-documents",
      "name": {
        "en": "Office & Documents",
        "zh-Hans": "办公与文档"
      }
    },
    {
      "id": "writing-communication",
      "name": {
        "en": "Writing & Communication",
        "zh-Hans": "写作与沟通"
      }
    },
    {
      "id": "web-development",
      "name": {
        "en": "Web & Development",
        "zh-Hans": "网页与开发"
      }
    },
    {
      "id": "research-data",
      "name": {
        "en": "Research & Data",
        "zh-Hans": "研究与数据"
      }
    },
    {
      "id": "design-creation",
      "name": {
        "en": "Design & Creation",
        "zh-Hans": "设计与创作"
      }
    },
    {
      "id": "product-requirements",
      "name": {
        "en": "Product & Requirements",
        "zh-Hans": "产品与需求"
      }
    },
    {
      "id": "productivity-organization",
      "name": {
        "en": "Productivity & Organization",
        "zh-Hans": "效率与整理"
      }
    }
  ],
  "hub": {
    "channelRoots": {
      "android": "android",
      "ios": "."
    },
    "pinsAuthority": "docs/UPSTREAM-PINS.json",
    "productionLayout": {
      "androidCatalog": "android/catalog.json",
      "androidPackages": "android/packages/{id}/{version}/{id}.zip",
      "androidSignature": "android/catalog.sig",
      "iosCatalog": "catalog.json",
      "iosPackages": "packages/{id}/{version}/{id}.zip",
      "iosSignature": "catalog.sig",
      "reviews": "reviews/{id}/{version}.review.json"
    },
    "repository": "JiangNanGenius/floe-skill-hub"
  },
  "notes": {
    "en": "Candidate registry for the first release target of 43 entries (4 app-bundled + 39 optional, 9 deep adaptations). The deprecated content-creator redirect is excluded. Every entry stays a candidate until license, package and functional qualification pass; nothing here claims reviewed, packaged, qualified, published or execution-verified status. Pinned commits are the review baseline from docs/UPSTREAM-PINS.json, not a blanket license: each item needs its own per-file license audit before packaging. License blockers are recorded per entry with reasons and required actions; the launch-set count rule (at most three blocked non-required candidates) is a coordinator release decision, not this file.",
    "zh-Hans": "首版 43 项目标候选登记（4 项内置 + 39 项按需，9 项深度适配）。已弃用的 content-creator 跳转不收录。每项在许可、打包与功能资格全部通过前都只是候选；本文件不宣称任何已审、已打包、已资格、已发布或执行验证状态。固定提交是 docs/UPSTREAM-PINS.json 的审核基线而非整体许可：每项素材仍需逐文件许可核验后方可打包。许可阻碍逐项记录原因与待办；可用数量阻碍规则（非必交付候选最多三项）由协调者在发布时决定，不由本文件宣称。"
  },
  "publisher": "JiangNanGenius",
  "registry": "candidate",
  "schemaVersion": 1,
  "skills": [
    {
      "category": "office-documents",
      "deepAdaptation": false,
      "description": {
        "en": "Read, annotate and organize PDFs, extract content and export the files you need.",
        "zh-Hans": "阅读、批注和整理 PDF，提取内容并导出所需文件。"
      },
      "firstParty": {
        "commit": "257acf30dcb1d40bd11860ec0b7f49ecc1ef32cd",
        "licenseEvidencePath": null,
        "licenseStatus": "floe-owned",
        "path": "skill-hub/sources/floe-pdf",
        "releasedVersion": "1.3.1",
        "repository": "https://github.com/JiangNanGenius/floe-agent",
        "retrievedAt": "2026-10-26",
        "skillManifestPath": "skill-hub/sources/floe-pdf/SKILL.md",
        "stagedSourceVersion": "1.3.2"
      },
      "id": "floe-pdf",
      "kind": "builtin",
      "minimumAppVersion": "1.7.59",
      "name": {
        "en": "Floe PDF",
        "zh-Hans": "Floe PDF"
      },
      "notes": {
        "en": "Ships inside the app; migrated to this hub for single-source maintenance. A pinned offline copy stays in the App build.",
        "zh-Hans": "随 App 内置；迁入本仓统一管理来源。App 构建保留固定提交导入的离线副本。"
      },
      "planNumber": 1,
      "plannedRuntime": {
        "capabilities": [],
        "execution": {
          "arch": "n/a",
          "evidence": "unproven",
          "os": null
        },
        "installPlatforms": [
          "ios"
        ],
        "pythonPackagesPlan": [],
        "scriptRuntime": "none",
        "tools": []
      },
      "source": "F",
      "status": {
        "adaptation": "in-progress",
        "executionVerified": false,
        "licenseChecked": false,
        "packaged": false,
        "published": false,
        "qualified": false,
        "reviewed": false,
        "sourcePinned": true
      },
      "tags": [
        "pdf",
        "documents",
        "annotation",
        "export"
      ],
      "upstream": null,
      "versionTarget": "1.3.2"
    },
    {
      "category": "office-documents",
      "deepAdaptation": false,
      "description": {
        "en": "Create and edit documents, spreadsheets and presentations with text, data and charts.",
        "zh-Hans": "创建和编辑文档、表格与演示，把文字、数据和图表整理成可交付的作品。"
      },
      "firstParty": {
        "commit": "257acf30dcb1d40bd11860ec0b7f49ecc1ef32cd",
        "licenseEvidencePath": null,
        "licenseStatus": "floe-owned",
        "path": "skill-hub/sources/floe-office",
        "releasedVersion": "1.3.0",
        "repository": "https://github.com/JiangNanGenius/floe-agent",
        "retrievedAt": "2026-10-26",
        "skillManifestPath": "skill-hub/sources/floe-office/SKILL.md",
        "stagedSourceVersion": "1.5.0"
      },
      "id": "floe-office",
      "kind": "builtin",
      "minimumAppVersion": "1.7.59",
      "name": {
        "en": "Floe Office",
        "zh-Hans": "Floe Office"
      },
      "notes": {
        "en": "Staged source is 1.5.0 while the released feed carries 1.3.0; the two states must never be mixed, and chart-workbook round-trip stays in qualification.",
        "zh-Hans": "源码已至 1.5.0 而已发布目录仍为 1.3.0；两种状态不得混同，图表工作簿往返编辑仍在资格确认。"
      },
      "planNumber": 2,
      "plannedRuntime": {
        "capabilities": [],
        "execution": {
          "arch": "n/a",
          "evidence": "unproven",
          "os": null
        },
        "installPlatforms": [
          "ios"
        ],
        "pythonPackagesPlan": [],
        "scriptRuntime": "none",
        "tools": []
      },
      "source": "F",
      "status": {
        "adaptation": "in-progress",
        "executionVerified": false,
        "licenseChecked": false,
        "packaged": false,
        "published": false,
        "qualified": false,
        "reviewed": false,
        "sourcePinned": true
      },
      "tags": [
        "office",
        "docx",
        "xlsx",
        "pptx",
        "charts"
      ],
      "upstream": null,
      "versionTarget": "1.5.0"
    },
    {
      "category": "web-development",
      "deepAdaptation": false,
      "description": {
        "en": "Check connectivity, DNS and network routes to investigate connection problems.",
        "zh-Hans": "检查网络连通性、DNS 与连接路径，定位连接问题。"
      },
      "firstParty": {
        "commit": "257acf30dcb1d40bd11860ec0b7f49ecc1ef32cd",
        "licenseEvidencePath": null,
        "licenseStatus": "floe-owned",
        "path": "skill-hub/sources/floe-network",
        "releasedVersion": "1.1.3",
        "repository": "https://github.com/JiangNanGenius/floe-agent",
        "retrievedAt": "2026-10-26",
        "skillManifestPath": "skill-hub/sources/floe-network/SKILL.md",
        "stagedSourceVersion": "1.1.4"
      },
      "id": "floe-network",
      "kind": "builtin",
      "minimumAppVersion": "1.7.59",
      "name": {
        "en": "Floe Network",
        "zh-Hans": "Floe Network"
      },
      "notes": {
        "en": "Ships inside the app; migrated to this hub for single-source maintenance.",
        "zh-Hans": "随 App 内置；迁入本仓统一管理来源。"
      },
      "planNumber": 3,
      "plannedRuntime": {
        "capabilities": [],
        "execution": {
          "arch": "n/a",
          "evidence": "unproven",
          "os": null
        },
        "installPlatforms": [
          "ios"
        ],
        "pythonPackagesPlan": [],
        "scriptRuntime": "none",
        "tools": []
      },
      "source": "F",
      "status": {
        "adaptation": "in-progress",
        "executionVerified": false,
        "licenseChecked": false,
        "packaged": false,
        "published": false,
        "qualified": false,
        "reviewed": false,
        "sourcePinned": true
      },
      "tags": [
        "network",
        "diagnostics",
        "icmp",
        "dns"
      ],
      "upstream": null,
      "versionTarget": "1.1.4"
    },
    {
      "category": "design-creation",
      "deepAdaptation": false,
      "description": {
        "en": "Inspect media files and handle common audio and video conversion tasks.",
        "zh-Hans": "查看媒体信息，完成常见音视频转码与封装。"
      },
      "firstParty": {
        "commit": "257acf30dcb1d40bd11860ec0b7f49ecc1ef32cd",
        "licenseEvidencePath": null,
        "licenseStatus": "floe-owned",
        "path": "skill-hub/sources/floe-video",
        "releasedVersion": "1.0.1",
        "repository": "https://github.com/JiangNanGenius/floe-agent",
        "retrievedAt": "2026-10-26",
        "skillManifestPath": "skill-hub/sources/floe-video/SKILL.md",
        "stagedSourceVersion": "1.0.2"
      },
      "id": "floe-video",
      "kind": "builtin",
      "minimumAppVersion": "1.7.59",
      "name": {
        "en": "Floe Video",
        "zh-Hans": "Floe Video"
      },
      "notes": {
        "en": "Retains real capability limits: unconnected editing and model paths are not advertised as available; its CoreML asset catalog lives with the app, not the ZIP.",
        "zh-Hans": "保留真实能力限制：未接通的编辑与模型路径不得宣称可用；其 CoreML 资产目录随 App 而不进 ZIP。"
      },
      "planNumber": 4,
      "plannedRuntime": {
        "capabilities": [],
        "execution": {
          "arch": "n/a",
          "evidence": "unproven",
          "os": null
        },
        "installPlatforms": [
          "ios"
        ],
        "pythonPackagesPlan": [],
        "scriptRuntime": "none",
        "tools": [
          "media.capabilities",
          "video.inspect",
          "video.transcode",
          "video.remux",